{
  "format": "taowind.opp.interop-run.v0.1",
  "version": "0.3.0-candidate.1",
  "runId": "github-rest-third-party-audit-2026-09-11",
  "producer": {
    "format": "taowind.opp.invocation-spec.v0.1",
    "version": "0.3.0-candidate.1",
    "adapterKind": "python-function",
    "sourceRoot": ".",
    "callingConvention": "kwargs",
    "timeoutMs": 20000,
    "maxOutputBytes": 262144,
    "cwdPolicy": "ephemeral",
    "environmentPolicy": "sanitized",
    "authorityRequired": [],
    "status": "candidate",
    "specId": "github-rest-producer",
    "entrypoint": "examples/third-party-fixtures/github_rest_producer.py:fetch_repository"
  },
  "bridgePlan": {
    "format": "taowind.opp.auto-bridge-plan.v0.1",
    "version": "0.2.0-candidate.1",
    "bridgeId": "bridge-plan-d7c9db8449fb0ef9a9e4f1d4",
    "status": "candidate",
    "producerPort": "github.repository.response",
    "consumerPort": "opp.audit.repository",
    "compatibility": {
      "format": "taowind.opp.bridge-compatibility.v0.1",
      "classification": "exact",
      "producerPort": "github.repository.response",
      "consumerPort": "opp.audit.repository",
      "typeCompatible": true,
      "semanticCompatible": true,
      "confidence": 1.0,
      "reasons": ["$:exact-shape"],
      "operations": [],
      "missingInformation": [],
      "authorityGap": [],
      "boundary": "Compatibility is inferred from the declared fixture shapes; it is not proof of universal GitHub or business compatibility."
    },
    "operations": [{"op": "identity"}],
    "executionModel": "opp-declarative-json-transform",
    "authority": {"required": [], "available": [], "promotionPerformed": false},
    "safety": {"sourceCodeExecution": false, "arbitraryCodeGeneration": false, "informationInvention": false, "authorityInvention": false, "lossyAllowed": false},
    "boundary": "This candidate bridge only preserves the selected JSON fields; it does not create permission or truth.",
    "planRoot": "9ed5291b1cecc0354185954353f380fc6f11b4ddd591d68b3e72f70e8bc077ac"
  },
  "consumer": {
    "format": "taowind.opp.invocation-spec.v0.1",
    "version": "0.3.0-candidate.1",
    "adapterKind": "python-function",
    "sourceRoot": ".",
    "callingConvention": "kwargs",
    "timeoutMs": 3000,
    "maxOutputBytes": 262144,
    "cwdPolicy": "ephemeral",
    "environmentPolicy": "sanitized",
    "authorityRequired": [],
    "status": "candidate",
    "specId": "local-repository-consumer",
    "entrypoint": "examples/third-party-fixtures/local_consumer.py:accept_repository"
  },
  "status": "candidate"
}
